{
  "schema": "dyfj.workbench.first-product.corpus/v1",
  "package_version": "workbench.first-product/v1",
  "profile": "focused-rule-fixture",
  "title": "Focused control corpus: the smallest admissible document",
  "expectation": {
    "outcome": "accept",
    "note": "The control for the negative fixtures: the same shape without any violation."
  },
  "rooms": [
    {
      "id": "room-focused",
      "identity_basis": "assigned-opaque",
      "revision": 1,
      "room_class": "operator-room",
      "persistence": "persistent",
      "labels": {
        "integrity_class": "attested",
        "secrecy_tags": [],
        "visibility": "room",
        "sensitivity": "low"
      }
    }
  ],
  "participants": [
    {
      "id": "participant-operator",
      "identity_basis": "assigned-opaque",
      "revision": 1,
      "participant_class": "human",
      "independent_of": [
        "model",
        "runner",
        "process",
        "user-interface"
      ]
    },
    {
      "id": "participant-agent",
      "identity_basis": "assigned-opaque",
      "revision": 1,
      "participant_class": "digital",
      "independent_of": [
        "model",
        "runner",
        "process",
        "user-interface"
      ]
    }
  ],
  "room_memberships": [
    {
      "id": "membership-operator",
      "identity_basis": "assigned-opaque",
      "revision": 1,
      "room": "room-focused",
      "participant": "participant-operator",
      "present": true,
      "may_author": true,
      "may_speak": true,
      "speak_rule": {
        "policy": "always-on",
        "loop_prevention": {
          "automated_summons": "blocked"
        }
      }
    },
    {
      "id": "membership-agent",
      "identity_basis": "assigned-opaque",
      "revision": 1,
      "room": "room-focused",
      "participant": "participant-agent",
      "present": true,
      "may_author": true,
      "may_speak": true,
      "speak_rule": {
        "policy": "mention",
        "mention_match": {
          "kind": "deterministic-token",
          "token": "primary-agent"
        },
        "loop_prevention": {
          "automated_summons": "blocked"
        }
      }
    }
  ],
  "threads": [
    {
      "id": "thread-focused",
      "identity_basis": "assigned-opaque",
      "revision": 1,
      "room": "room-focused",
      "thread_class": "main"
    }
  ],
  "agent_specs": [
    {
      "id": "agent-spec-focused",
      "identity_basis": "assigned-opaque",
      "revision": 1,
      "spec_version": 1,
      "participant": "participant-agent",
      "behavior": [
        "conversational-chief-of-staff"
      ],
      "posture": {
        "autonomy": "supervised-autonomous",
        "escalation": "ask-operator"
      },
      "tools": [
        "workspace-read"
      ],
      "guardrails": [
        "no-external-impact"
      ]
    }
  ],
  "capability_grants": [
    {
      "id": "grant-focused",
      "identity_basis": "assigned-opaque",
      "revision": 1,
      "grantor": "participant-operator",
      "grantee": "participant-agent",
      "delegable": false,
      "policy_basis": {
        "policy_id": "policy-envelope",
        "decision": "allowed"
      },
      "scope": {
        "tools": [
          "workspace-read"
        ],
        "resources": [
          "workspace-notes"
        ],
        "workspace": "read-only",
        "network": "none",
        "budget": {
          "currency": "usd",
          "limit_minor_units": 100
        },
        "approvals": [],
        "external_impact": "none",
        "destination_classes": [
          "none"
        ],
        "scope_dispositions": {
          "provider_scope": "not-applicable",
          "route_scope": "not-applicable",
          "task_scope": "not-applicable",
          "room_scope": "not-applicable",
          "secrecy_integrity_authorization": "not-applicable"
        }
      }
    }
  ],
  "tasks": [
    {
      "id": "task-focused",
      "identity_basis": "assigned-opaque",
      "revision": 1,
      "room": "room-focused",
      "thread": "thread-focused",
      "state": "task:proposed",
      "envelope": {
        "approved": true,
        "grant": "grant-focused"
      },
      "execution_envelope": {
        "objective": "Record one proposed task for the focused control corpus.",
        "context_scope": "No context assembly has occurred yet.",
        "assigned_agent_spec": "agent-spec-focused",
        "posture": {
          "autonomy": "supervised-autonomous",
          "escalation": "ask-operator"
        },
        "route_requirements": {
          "execution_lane": "either"
        },
        "tools": [
          "workspace-read"
        ],
        "workspace": "read-only",
        "budget": {
          "currency": "usd",
          "limit_minor_units": 100
        },
        "guardrails": [
          "no-external-impact"
        ]
      },
      "completion_criteria": [
        "The focused corpus records one proposed task."
      ],
      "verification_contract": {
        "method": "operator-review",
        "required_evidence": [
          "artifact-digest"
        ]
      },
      "transitions": []
    }
  ],
  "deferrals": [
    {
      "id": "deferral-memory-claim",
      "capability": "memory-claim-implementation",
      "status": "deferred",
      "required": false,
      "implemented": false,
      "authoritative": false,
      "routable": false,
      "reserved_identifier": "memory-claim",
      "note": "Reserved name only; the focused profile requires no deferral inventory."
    }
  ]
}
